{
  "schema": "danse.opportunities.v1",
  "snapshot_id": "omega-20260804",
  "frozen_at": "2026-08-04T01:44:00Z",
  "owner_issue": 15,
  "successor_issue": 22,
  "policy": {
    "immutable": true,
    "fact_statuses": [
      "verified",
      "unstated",
      "not-applicable",
      "conflicted"
    ],
    "dispositions": [
      "active",
      "closed",
      "watch",
      "conflicted",
      "blocked",
      "historical"
    ],
    "external_actions": "human-gated"
  },
  "release_consumers": [
    {
      "issue": 2,
      "role": "ScreenDance filing register",
      "status": "bound"
    },
    {
      "issue": 12,
      "role": "canonical Omega release manifest",
      "status": "pending"
    }
  ],
  "ranked_actions": [
    {
      "rank": 1,
      "opportunity_id": "oolite-ellies-creator-2027",
      "action": "Anthony must establish South Florida eligibility and decide whether to file before the extended 3 August 11:59 p.m. ET deadline."
    },
    {
      "rank": 2,
      "opportunity_id": "oolite-studio-residency-2027",
      "action": "Anthony must establish residency eligibility, rank any dual Oolite applications consistently, and decide whether to file before the same extended deadline."
    },
    {
      "rank": 3,
      "opportunity_id": "screendance-miami-2027",
      "action": "Finish issues 8 through 10 and 16, then validate and file only the artist-approved score-driven package through issue 2."
    },
    {
      "rank": 4,
      "opportunity_id": "cinedans-fest-2027-installation",
      "action": "Finish the issue 14 room evidence and submit the installation through the portal, with supplemental material sent only by the account owner."
    },
    {
      "rank": 5,
      "opportunity_id": "times-square-midnight-moment",
      "action": "After the final cut exists, build the required silent 170-second horizontal derivative and release-manifest stills."
    },
    {
      "rank": 6,
      "opportunity_id": "cinedans-2028-international-short",
      "action": "Preserve this longer-run film target for the accepted final cut and confirm the selected-master deadline typo before any filing."
    },
    {
      "rank": 7,
      "opportunity_id": "mignolo-screendance-2026",
      "action": "Ask Mignolo to reconcile its official New Jersey page with the published Brussels 2026 call, deadline, venue, fee, and current FilmFreeway terms."
    },
    {
      "rank": 8,
      "opportunity_id": "miami-dade-tdc-2026-q2",
      "action": "Identify an eligible Miami-Dade nonprofit applicant and attend or schedule the mandatory pre-application contact before treating this as a grant route."
    }
  ],
  "opportunities": [
    {
      "id": "bakehouse-studio-residency-2026",
      "name": "Studio Artist Residency Program 2026–2028",
      "organization": "Bakehouse Art Complex",
      "disposition": "closed",
      "fit": "residency",
      "owner_issue": 15,
      "deadline_at": "2026-05-01T23:45:00-05:00",
      "sources": [
        {
          "url": "https://www.bacfl.org/air-programs",
          "kind": "official",
          "checked_at": "2026-08-03T21:43:00-04:00"
        }
      ],
      "facts": [
        {
          "id": "deadline",
          "status": "verified",
          "value": "Applications closed; the official page states 1 May 2026 at 11:45 p.m. EST, not the 1 August short-term deadline in the predecessor plan.",
          "source": "https://www.bacfl.org/air-programs"
        },
        {
          "id": "eligibility",
          "status": "verified",
          "value": "Affordable two-year studio residency for Miami-based artists; residency term 1 November 2026 through 31 October 2028.",
          "source": "https://www.bacfl.org/air-programs"
        },
        {
          "id": "fee",
          "status": "verified",
          "value": "Studio costs are capped at approximately 50% of market rate; the separate Associate Artist Program costs $550 per year.",
          "source": "https://www.bacfl.org/air-programs"
        },
        {
          "id": "terms",
          "status": "verified",
          "value": "The current page explicitly says applications are closed and routes questions to Residency Program Coordinator Christine Cortes.",
          "source": "https://www.bacfl.org/air-programs"
        }
      ],
      "dependencies": [],
      "human_gates": [],
      "next_action": "No action in this frozen release; issue 22 may watch for a later cycle."
    },
    {
      "id": "cinedans-2028-international-short",
      "name": "International Short Film Competition 2028",
      "organization": "Cinedans",
      "disposition": "active",
      "fit": "film",
      "owner_issue": 2,
      "deadline_at": "2027-06-30T23:59:00+02:00",
      "sources": [
        {
          "url": "https://cinedans.nl/p/welcome_entries",
          "kind": "official",
          "checked_at": "2026-08-03T21:43:00-04:00"
        },
        {
          "url": "https://filmchief.com/festivals/cinedans/download/2027/Terms%20and%20Conditions%20Cinedans%202027.pdf?v=1",
          "kind": "terms",
          "checked_at": "2026-08-03T21:43:00-04:00"
        }
      ],
      "facts": [
        {
          "id": "deadline",
          "status": "verified",
          "value": "30 June 2027; the source does not publish a cutoff time, so the encoded 23:59 Europe/Amsterdam time is only a conservative scheduling boundary.",
          "source": "https://cinedans.nl/p/welcome_entries"
        },
        {
          "id": "eligibility",
          "status": "verified",
          "value": "International professional fiction or experimental dance films, 1–25 minutes, under three years old, not submitted to prior Cinedans editions; maximum three submissions per filmmaker.",
          "source": "https://filmchief.com/festivals/cinedans/download/2027/Terms%20and%20Conditions%20Cinedans%202027.pdf?v=1"
        },
        {
          "id": "fee",
          "status": "verified",
          "value": "€20 entry fee.",
          "source": "https://cinedans.nl/p/welcome_entries"
        },
        {
          "id": "runtime",
          "status": "verified",
          "value": "Between 1 and 25 minutes.",
          "source": "https://filmchief.com/festivals/cinedans/download/2027/Terms%20and%20Conditions%20Cinedans%202027.pdf?v=1"
        },
        {
          "id": "container",
          "status": "conflicted",
          "value": "Selected films require DCP and ProRes, but the official terms say the master is due before the end of January 2026, an impossible date for this 2028 competition.",
          "source": "https://filmchief.com/festivals/cinedans/download/2027/Terms%20and%20Conditions%20Cinedans%202027.pdf?v=1",
          "resolve": "Ask entry@cinedans.nl for the corrected master deadline and current DCP/ProRes specifications before filing."
        },
        {
          "id": "aspect",
          "status": "unstated",
          "value": null,
          "resolve": "Ask entry@cinedans.nl or use the selected-film technical specification when issued."
        },
        {
          "id": "captions",
          "status": "unstated",
          "value": null,
          "resolve": "Ask entry@cinedans.nl whether English captions or subtitles are mandatory for non-dialogue, dialogue, and accessibility tracks."
        },
        {
          "id": "credits",
          "status": "verified",
          "value": "Entry-form film information is used for festival publications; catalogue writing remains at festival discretion.",
          "source": "https://filmchief.com/festivals/cinedans/download/2027/Terms%20and%20Conditions%20Cinedans%202027.pdf?v=1"
        },
        {
          "id": "installation",
          "status": "not-applicable",
          "value": "This entry is the international short-film competition; the installation route is recorded separately."
        },
        {
          "id": "terms",
          "status": "verified",
          "value": "Up to three festival screenings without screening fees; promotional use of submitted film, stills, posters and trailers, including an excerpt up to 10% or three minutes; submitter warrants all rights; travel and lodging are not covered.",
          "source": "https://filmchief.com/festivals/cinedans/download/2027/Terms%20and%20Conditions%20Cinedans%202027.pdf?v=1"
        }
      ],
      "dependencies": [
        {
          "issue": 10,
          "status": "pending",
          "detail": "A new artist-approved score-driven final cut does not yet exist."
        },
        {
          "issue": 16,
          "status": "pending",
          "detail": "The exact final package rights manifest and attestations remain pending."
        }
      ],
      "human_gates": [
        {
          "id": "fee-and-submit",
          "owner": "Anthony",
          "status": "required",
          "action": "Approve the final work, pay the €20 fee, accept terms, and send through the account-owned portal."
        }
      ],
      "next_action": "Hold for the final cut, then resolve the official date typo before an account-owned filing."
    },
    {
      "id": "cinedans-fest-2027-installation",
      "name": "FEST '27 Out of Competition — installation/project proposal",
      "organization": "Cinedans",
      "disposition": "active",
      "fit": "installation",
      "owner_issue": 14,
      "deadline_at": "2026-09-15T23:59:00+02:00",
      "sources": [
        {
          "url": "https://cinedans.nl/p/welcome_entries",
          "kind": "official",
          "checked_at": "2026-08-03T21:43:00-04:00"
        },
        {
          "url": "https://filmchief.com/festivals/cinedans/download/2027/Terms%20and%20Conditions%20Cinedans%202027.pdf?v=1",
          "kind": "terms",
          "checked_at": "2026-08-03T21:43:00-04:00"
        }
      ],
      "facts": [
        {
          "id": "deadline",
          "status": "verified",